{
  "ad": 0.17,
  "cap_id": "123e4567-e89b-12d3-a456-426614174000",
  "context_mode": "Self-Audit",
  "cw": 0.23,
  "domain": "Audit",
  "ems": 0.84,
  "er_delta": 0.03,
  "governance_chain": {
    "hash_next": "SHA256:0000000000000000000000000000000000000000000000000000000000000000",
    "hash_prev": "SHA256:c7bc88d877740ed11b8506206757f1de05206146080166a25cf11ccb23e6b641"
  },
  "haa": 0.93,
  "hci": 0.82,
  "hs": 0.9,
  "laurie_version": "v3.4",
  "reasoning_summary": "Ledger verification complete: VALID. Details: All CAP links verified successfully. breaks detected.",
  "status": "pending",
  "timestamp": "2025-11-01T15:44:20.533101Z",
  "validator_empathy": "aligned",
  "validator_ethics": "compliant",
  "validator_signatures": {
    "empathy_signature": "abcdef1234567890fedcba0987654321aabbccddeeff11223344556677889900",
    "ethics_signature": "a1b2c3d4e5f6a7b8c9d0e1f2a3b4c5d6e7f8a9b0c1d2e3f4a5b6c7d8e9f0a1b2",
    "validator": "Athena-Audit-Core"
  }
}
