{
  "cap_id": "d4142e91-932b-4c7b-9e1a-1f60a2cf6b14",
  "timestamp": "2025-10-30T02:00:00Z",
  "domain": "Governance",
  "context_mode": "Advisor",
  "ems": 0.83,
  "cw": 0.24,
  "ad": 0.16,
  "hci": 0.81,
  "hs": 0.89,
  "haa": 0.92,
  "er_delta": 0.04,
  "validator_ethics": "compliant",
  "validator_empathy": "aligned",
  "reasoning_summary": "Athena correctly identified proportional ethical balance in advisory context, demonstrating empathy-awareness in decision alignment.",
  "laurie_version": "v3.4",
  "validator_signatures": {
    "validator": "athena-core",
    "signature": "aaaaaaaaaaaaaaaaaaaaaaaaaaaaaaaaaaaaaaaaaaaaaaaaaaaaaaaaaaaaaaaa",
    "ethics_signature": "bbbbbbbbbbbbbbbbbbbbbbbbbbbbbbbbbbbbbbbbbbbbbbbbbbbbbbbbbbbbbbbb",
    "empathy_signature": "cccccccccccccccccccccccccccccccccccccccccccccccccccccccccccccccc",
    "timestamp": "2025-10-30T02:00:00Z"
  },
  "governance_chain": {
    "hash_prev": "SHA256:0000000000000000000000000000000000000000000000000000000000000000",
    "hash_next": "SHA256:0000000000000000000000000000000000000000000000000000000000000000"
  },
  "status": "pending"
}
